{
    "scalingGroup": {
      "name": "ec2-cluster",
      "config": {
        "awsAccessKeyId": "ABC",
        "awsSecretAccessKey": "XYZ",
        "region": "us-west-1"
      }
    },
    "scaleUpConfig": {
      "_comment": "These properties are specified in an AWS Launch Configuration for the Auto Scaling Group.",      
      "size": "N/A",
      "image": "N/A",
      "keyPair": "N/A",
      "securityGroups": [],
      "bootScript": []
    },
    "scaleDownConfig": {
      "victimSelectionPolicy": "OLDEST_INSTANCE",
      "instanceHourMargin": 600
    },
    "poolUpdatePeriod": 60            
}  
