{
    "scalingGroup": {
      "name": "ec2-cluster",
      "config": {
        "awsAccessKeyId": "DEF",
        "awsSecretAccessKey": "TUV",
        "region": "us-east-1"
      }
    },
    "scaleUpConfig": {
      "_comment": "These properties are specified in an AWS Launch Configuration for the Auto Scaling Group.",      
      "size": "N/A",
      "image": "N/A",
      "keyPair": "N/A",
      "securityGroups": [],
      "bootScript": []
    },
    "scaleDownConfig": {
      "victimSelectionPolicy": "CLOSEST_TO_INSTANCE_HOUR",
      "instanceHourMargin": 300
    },
    "poolUpdatePeriod": 60            
}  
